{
  "id": "shimadzu-xslicer",
  "kind": "equipment_series",
  "name": "Shimadzu Xslicer SMX-6010 / SMX-1010 / SMX-1020 Microfocus X-Ray Inspection Systems",
  "name_ko": "시마즈 Xslicer 마이크로포커스 X선 투시 검사 장비",
  "manufacturer": "shimadzu",
  "brand": "Xslicer",
  "category": "xray_inspection",
  "form_factor": "floor",
  "description": "전자부품·기판 검사용 마이크로포커스 X선 투시 장비. SMX-6010 은 160 kV · 16 W 튜브와 평판 검출기로 JIMA 차트 1 µm 분해능을 내고, 시료 470 × 420 × 100 mm · 5 kg, ±180° 회전 · 60° 기울임, 45° 또는 60° 라미노그래피로 평면 CT(350 × 350 mm 범위)를 한다. SMX-1010 · SMX-1020 은 90 kV · 10 W 튜브의 소형 기종으로 JIMA RT RC-05 5 µm 상당, 시료 350 × 450 × 100 mm · 5 kg 이며 SMX-1020 은 검출기 화소가 약 2.8 백만으로 시야가 넓다.",
  "test_items": [
    "xray_void_inspection"
  ],
  "materials": [
    "PCB assemblies",
    "electronic components"
  ],
  "limits": {
    "tube_voltage_kV": {
      "min": 90,
      "max": 160,
      "note": "기종별 최대 관전압. SMX-1010/1020 90 kV, SMX-6010 160 kV"
    },
    "tube_current_mA": {
      "max": 0.25,
      "note": "원문 SMX-1010/1020 250 µA, SMX-6010 100 µA"
    },
    "tube_power_W": {
      "min": 10,
      "max": 16
    },
    "spatial_resolution_um": {
      "min": 1,
      "note": "SMX-6010 JIMA 차트 1 µm. SMX-1010/1020 은 JIMA RT RC-05 5 µm 상당(이론값)"
    },
    "sample_size_mm": {
      "max": 470,
      "note": "SMX-6010 470 × 420 × 100 mm, SMX-1010/1020 350 × 450 mm · 높이 100 mm"
    },
    "sample_weight_kg": {
      "max": 5
    },
    "operating_temperature_degC": {
      "min": 10,
      "max": 30
    }
  },
  "models": [
    {
      "model": "SMX-6010",
      "specs": {
        "tube_voltage_kV": 160,
        "tube_current_mA": 0.1,
        "tube_power_W": 16,
        "spatial_resolution_um": {
          "min": 1,
          "note": "JIMA chart resolution"
        },
        "sample_size_mm": "470 × 420 × 100",
        "sample_weight_kg": 5,
        "stage_travel_mm": "X 460 / Y 410 / Z 100, ±180° 회전, 60° 기울임",
        "scan_range_mm": "CT X 350 / Y 350",
        "detector": "평판 검출기",
        "field_of_view_mm": "투시 0.75 (V) × 1.3 (H) ~ 20 (V) × 38 mm; CT 3~30 mm (45°) / 3~14 mm (60°)",
        "power": "200 V AC ±10 %, 1.5 kVA",
        "weight_kg": 2450,
        "operating_temperature_degC": {
          "min": 15,
          "max": 30
        },
        "operating_humidity_pct": {
          "min": 35,
          "max": 80,
          "note": "비응축"
        }
      },
      "note": "라미노그래피 각도(°): 45 / 60; X선 누설: 1 µSv/h max."
    },
    {
      "model": "SMX-1010",
      "specs": {
        "tube_voltage_kV": 90,
        "tube_current_mA": 0.25,
        "tube_power_W": 10,
        "spatial_resolution_um": {
          "min": 5,
          "note": "JIMA RT RC-05 micro chart 5 µm 상당(이론값). 탄소판 위 7 µm 에서 MTF 0.1 이상"
        },
        "sample_size_mm": "350 × 450, 높이 100",
        "sample_weight_kg": 5,
        "detector_megapixels": {
          "min": 1.4,
          "max": 1.5,
          "uncertain": true,
          "note": "같은 사양 페이지를 두 번 읽은 결과가 '약 1.4 million' 과 '약 1.50 million, 수광면 64 × 57 mm' 로 갈림"
        },
        "field_of_view_mm": "1.9 (V) × 2.2 (H) ~ 38 (V) × 43 (H), 탄소판 기준",
        "power": "단상 100~240 VAC ±10 %, 50/60 Hz, 0.5 kVA",
        "weight_kg": 700,
        "operating_temperature_degC": {
          "min": 10,
          "max": 30
        },
        "operating_humidity_pct": {
          "min": 40,
          "max": 80,
          "note": "비응축"
        }
      },
      "note": "경사(°): 60; X선 누설: 1 µSv/h 이하"
    },
    {
      "model": "SMX-1020",
      "specs": {
        "tube_voltage_kV": 90,
        "tube_current_mA": 0.25,
        "tube_power_W": 10,
        "spatial_resolution_um": {
          "min": 5,
          "note": "SMX-1010 과 같음"
        },
        "detector_megapixels": 2.8,
        "field_of_view_mm": "2.2 (V) × 3.8 (H) ~ 42 (V) × 76 (H), 탄소판 기준",
        "weight_kg": 700
      }
    }
  ],
  "features": [
    "라미노그래피(45° · 60°) 평면 CT (SMX-6010)",
    "60° 경사 투시"
  ],
  "relations": [
    {
      "type": "performs",
      "target": "xray_void_inspection"
    },
    {
      "type": "same_family_as",
      "target": "shimadzu-xray-ct"
    }
  ],
  "sources": [
    {
      "url": "https://shimadzu.com/an/products/non-destructive-testing/microfocus-x-ray-inspection-system/xslicer-smx-6010/spec.html",
      "retrieved": "2026-10-08",
      "note": "제조사 사양 페이지(SMX-6010)"
    },
    {
      "url": "https://shimadzu.com/an/products/non-destructive-testing/microfocus-x-ray-inspection-system/xslicer-smx-10101020/spec.html",
      "retrieved": "2026-10-08",
      "note": "제조사 사양 페이지(SMX-1010 · SMX-1020)"
    }
  ],
  "notes": "초점 크기는 사양 페이지에 따로 없다.",
  "confidence": "limited"
}
